{
  "schema_version": "temple.work-item/v1",
  "id": "WI-0260",
  "title": "Implement Workkeel workflows, model routing and user-facing delivery",
  "state": "build",
  "owner_position": "developer",
  "assigned_agent_id": "agent-rikku",
  "created_at": "2026-09-23T13:17:10.180Z",
  "updated_at": "2026-09-23T13:22:22.449Z",
  "scope": [
    "Deliver the approved P01-P10 Workkeel automation, native onboarding, terminology, skills, docs, OSS and cleanup plan. No publication or paid live provider use without configured authority."
  ],
  "acceptance_criteria": [
    "A persistent bounded workflow executes approved steps with dependency, branch, retry, approval, cancellation and recovery semantics; runtime completion never bypasses task acceptance.",
    "Model routing and Headroom policies are applied through explicit supported runtime boundaries, with offline protocol and failure tests and honest live qualification status.",
    "Claude onboarding, Skills checks, three-language README, editable diagrams, measured validation, OSS notices and current-document cleanup are verified."
  ],
  "affected_paths": [
    "src",
    "test",
    "docs",
    "project-overlay",
    "package.json",
    "package-lock.json",
    "README.md",
    "README.zh-TW.md",
    "README.ja.md",
    "THIRD_PARTY_NOTICES.md",
    ".ai-org/project/domain-glossary.md",
    ".ai-org/decisions"
  ],
  "context_refs": [],
  "spec_refs": [],
  "ux_refs": [],
  "ui_refs": [],
  "contract_refs": [],
  "specification_mode": "gate-evidence",
  "ui_delivery_mode": "not-applicable",
  "workflow_profile": "standard",
  "risk_tier": "standard",
  "profile_assessment": {
    "requested_profile": "standard",
    "effective_profile": "standard",
    "scope_class": "cross-system",
    "escalation_triggers": [
      "schema-or-data-migration"
    ],
    "rationale": "Opt-in trusted-host workflow orchestration; do not create a new security sandbox or weaken host restrictions. No live spend, production deployment or publication in local implementation.",
    "evidence_refs": [],
    "evaluated_at": "2026-09-23T13:17:10.167Z",
    "escalated": false
  },
  "parent_work_item_id": null,
  "tracker_visibility": "internal",
  "tracker_refs": [],
  "tracker_reconciliations": [],
  "dependencies": [],
  "required_disciplines": [],
  "stage_requirements": {},
  "base_revision": "f2d0554023fa186f27d7b0d7bd98bd4368dfd111",
  "parallel_mode": "pending",
  "integration_owner_agent_id": null,
  "planned_agent_id": null,
  "shared_contract_refs": [],
  "contract_status": "not_required",
  "overlap_resolution": [],
  "claim": {
    "id": "claim-20260923132222-6bc97f70",
    "status": "active",
    "principal_id": "human",
    "agent_id": "agent-rikku",
    "actor_provenance": {
      "selection": "explicit-agent",
      "principal_source": "explicit-principal",
      "verification_class": "attributed",
      "evidence_ref": null,
      "provider_authenticated": false,
      "externally_supplied_evidence": false
    },
    "position_id": "developer",
    "base_revision": "f2d0554023fa186f27d7b0d7bd98bd4368dfd111",
    "branch": "codex/workkeel-automation",
    "worktree": ".",
    "claimed_at": "2026-09-23T13:22:22.449Z",
    "released_at": null
  },
  "claims": [
    {
      "id": "claim-20260923131735-f936713e",
      "status": "released",
      "principal_id": "human",
      "agent_id": "agent-mog",
      "actor_provenance": {
        "selection": "explicit-agent",
        "principal_source": "explicit-principal",
        "verification_class": "attributed",
        "evidence_ref": null,
        "provider_authenticated": false,
        "externally_supplied_evidence": false
      },
      "position_id": "engineering_manager",
      "base_revision": "f2d0554023fa186f27d7b0d7bd98bd4368dfd111",
      "branch": "codex/workkeel-automation",
      "worktree": ".",
      "claimed_at": "2026-09-23T13:17:35.549Z",
      "released_at": "2026-09-23T13:19:18.678Z",
      "release_reason": [
        "Approved implementation work order recorded; proceed to specification."
      ]
    },
    {
      "id": "claim-20260923131919-f6e77621",
      "status": "released",
      "principal_id": "human",
      "agent_id": "agent-yuna",
      "actor_provenance": {
        "selection": "explicit-agent",
        "principal_source": "explicit-principal",
        "verification_class": "attributed",
        "evidence_ref": null,
        "provider_authenticated": false,
        "externally_supplied_evidence": false
      },
      "position_id": "product_manager",
      "base_revision": "f2d0554023fa186f27d7b0d7bd98bd4368dfd111",
      "branch": "codex/workkeel-automation",
      "worktree": ".",
      "claimed_at": "2026-09-23T13:19:19.757Z",
      "released_at": "2026-09-23T13:20:46.963Z",
      "release_reason": [
        "Scope and acceptance specified from approved P01-P10."
      ]
    },
    {
      "id": "claim-20260923132048-cff96e74",
      "status": "released",
      "principal_id": "human",
      "agent_id": "agent-tidus",
      "actor_provenance": {
        "selection": "explicit-agent",
        "principal_source": "explicit-principal",
        "verification_class": "attributed",
        "evidence_ref": null,
        "provider_authenticated": false,
        "externally_supplied_evidence": false
      },
      "position_id": "tech_lead",
      "base_revision": "f2d0554023fa186f27d7b0d7bd98bd4368dfd111",
      "branch": "codex/workkeel-automation",
      "worktree": ".",
      "claimed_at": "2026-09-23T13:20:48.061Z",
      "released_at": "2026-09-23T13:22:21.410Z",
      "release_reason": [
        "Versioned specification and OSS-aware implementation decision recorded."
      ]
    },
    {
      "id": "claim-20260923132222-6bc97f70",
      "status": "active",
      "principal_id": "human",
      "agent_id": "agent-rikku",
      "actor_provenance": {
        "selection": "explicit-agent",
        "principal_source": "explicit-principal",
        "verification_class": "attributed",
        "evidence_ref": null,
        "provider_authenticated": false,
        "externally_supplied_evidence": false
      },
      "position_id": "developer",
      "base_revision": "f2d0554023fa186f27d7b0d7bd98bd4368dfd111",
      "branch": "codex/workkeel-automation",
      "worktree": ".",
      "claimed_at": "2026-09-23T13:22:22.449Z",
      "released_at": null
    }
  ],
  "gate_evidence": {
    "work_order": [
      ".ai-org/artifacts/WI-0260/work-order.md"
    ],
    "approved_scope": [
      ".ai-org/artifacts/WI-0260/specification.md"
    ],
    "acceptance_criteria": [
      ".ai-org/artifacts/WI-0260/specification.md"
    ],
    "technical_design": [
      "docs/adr/0073-opt-in-workflow-execution.md"
    ],
    "risk_review": [
      ".ai-org/artifacts/WI-0260/work-order.md"
    ]
  },
  "evidence": [
    ".ai-org/artifacts/WI-0260/work-order.md",
    ".ai-org/artifacts/WI-0260/specification.md",
    "docs/adr/0073-opt-in-workflow-execution.md"
  ],
  "unresolved": [],
  "next_position": "quality_evaluator"
}
