{
  "schema_version": "temple.work-item/v1",
  "id": "WI-0001",
  "title": "Replace with a durable outcome-oriented title",
  "state": "intake",
  "owner_position": "engineering_manager",
  "assigned_agent_id": null,
  "created_at": "",
  "updated_at": "",
  "scope": [],
  "acceptance_criteria": [],
  "affected_paths": [],
  "context_refs": [],
  "spec_refs": [],
  "ux_refs": [],
  "ui_refs": [],
  "contract_refs": [],
  "specification_mode": "gate-evidence",
  "ui_delivery_mode": null,
  "parent_work_item_id": null,
  "tracker_visibility": "team-visible",
  "tracker_refs": [],
  "tracker_reconciliations": [],
  "dependencies": [],
  "required_disciplines": [],
  "base_revision": null,
  "parallel_mode": "pending",
  "integration_owner_agent_id": null,
  "planned_agent_id": null,
  "shared_contract_refs": [],
  "contract_status": "not_required",
  "overlap_resolution": [],
  "claim": null,
  "claims": [],
  "gate_evidence": {},
  "evidence": [],
  "unresolved": [],
  "next_position": "product_manager"
}
