{
  "schema_version": "temple.work-item/v1",
  "id": "WI-0272",
  "title": "Reduce dispatch context and observer snapshot latency",
  "state": "build",
  "owner_position": "developer",
  "assigned_agent_id": "agent-rikku",
  "created_at": "2026-09-25T05:22:21.143Z",
  "updated_at": "2026-09-25T05:24:11.703Z",
  "scope": [
    "Compact lossless Codex payload and bounded observer reads; preserve permissions, validation, ordering and failure semantics; paired diagnostics and normal PR integration"
  ],
  "acceptance_criteria": [
    "Existing safety gates unchanged; lower envelope bytes and measured 200-task snapshot latency; full verification and actual distinct review pass"
  ],
  "affected_paths": [
    "src/workkeel-codex-runtime.mjs",
    "src/workkeel-monitor.mjs",
    "src/workkeel-measurements.mjs",
    "test",
    "docs"
  ],
  "context_refs": [],
  "spec_refs": [],
  "ux_refs": [],
  "ui_refs": [],
  "contract_refs": [],
  "specification_mode": "gate-evidence",
  "ui_delivery_mode": "not-applicable",
  "workflow_profile": "standard",
  "risk_tier": "standard",
  "profile_assessment": {
    "requested_profile": "standard",
    "effective_profile": "standard",
    "scope_class": "ordinary",
    "escalation_triggers": [],
    "rationale": "",
    "evidence_refs": [],
    "evaluated_at": "2026-09-25T05:22:21.133Z",
    "escalated": false
  },
  "parent_work_item_id": null,
  "tracker_visibility": "team-visible",
  "tracker_refs": [],
  "tracker_reconciliations": [],
  "dependencies": [],
  "required_disciplines": [],
  "stage_requirements": {},
  "base_revision": "f206dbff61be25b35f3a9d7b520ecff464c001a5",
  "parallel_mode": "pending",
  "integration_owner_agent_id": null,
  "planned_agent_id": null,
  "shared_contract_refs": [],
  "contract_status": "not_required",
  "overlap_resolution": [],
  "claim": {
    "id": "claim-20260925052411-c2f4c150",
    "status": "active",
    "principal_id": "human",
    "agent_id": "agent-rikku",
    "actor_provenance": {
      "selection": "explicit-agent",
      "principal_source": "explicit-principal",
      "verification_class": "attributed",
      "evidence_ref": null,
      "provider_authenticated": false,
      "externally_supplied_evidence": false
    },
    "position_id": "developer",
    "base_revision": "f206dbff61be25b35f3a9d7b520ecff464c001a5",
    "branch": "codex/scenario-efficiency",
    "worktree": null,
    "claimed_at": "2026-09-25T05:24:11.703Z",
    "released_at": null
  },
  "claims": [
    {
      "id": "claim-20260925052318-e84ada63",
      "status": "released",
      "principal_id": "human",
      "agent_id": "agent-mog",
      "actor_provenance": {
        "selection": "explicit-agent",
        "principal_source": "explicit-principal",
        "verification_class": "attributed",
        "evidence_ref": null,
        "provider_authenticated": false,
        "externally_supplied_evidence": false
      },
      "position_id": "engineering_manager",
      "base_revision": "HEAD",
      "branch": "codex/scenario-efficiency",
      "worktree": null,
      "claimed_at": "2026-09-25T05:23:18.324Z",
      "released_at": "2026-09-25T05:24:07.573Z",
      "release_reason": [
        "Approved bounded scope recorded"
      ]
    },
    {
      "id": "claim-20260925052408-15ba1008",
      "status": "released",
      "principal_id": "human",
      "agent_id": "agent-yuna",
      "actor_provenance": {
        "selection": "explicit-agent",
        "principal_source": "explicit-principal",
        "verification_class": "attributed",
        "evidence_ref": null,
        "provider_authenticated": false,
        "externally_supplied_evidence": false
      },
      "position_id": "product_manager",
      "base_revision": "f206dbff61be25b35f3a9d7b520ecff464c001a5",
      "branch": "codex/scenario-efficiency",
      "worktree": null,
      "claimed_at": "2026-09-25T05:24:08.709Z",
      "released_at": "2026-09-25T05:24:09.077Z",
      "release_reason": [
        "Approved bounded scope recorded"
      ]
    },
    {
      "id": "claim-20260925052410-d69b164e",
      "status": "released",
      "principal_id": "human",
      "agent_id": "agent-tidus",
      "actor_provenance": {
        "selection": "explicit-agent",
        "principal_source": "explicit-principal",
        "verification_class": "attributed",
        "evidence_ref": null,
        "provider_authenticated": false,
        "externally_supplied_evidence": false
      },
      "position_id": "tech_lead",
      "base_revision": "f206dbff61be25b35f3a9d7b520ecff464c001a5",
      "branch": "codex/scenario-efficiency",
      "worktree": null,
      "claimed_at": "2026-09-25T05:24:10.206Z",
      "released_at": "2026-09-25T05:24:10.576Z",
      "release_reason": [
        "Approved bounded scope recorded"
      ]
    },
    {
      "id": "claim-20260925052411-c2f4c150",
      "status": "active",
      "principal_id": "human",
      "agent_id": "agent-rikku",
      "actor_provenance": {
        "selection": "explicit-agent",
        "principal_source": "explicit-principal",
        "verification_class": "attributed",
        "evidence_ref": null,
        "provider_authenticated": false,
        "externally_supplied_evidence": false
      },
      "position_id": "developer",
      "base_revision": "f206dbff61be25b35f3a9d7b520ecff464c001a5",
      "branch": "codex/scenario-efficiency",
      "worktree": null,
      "claimed_at": "2026-09-25T05:24:11.703Z",
      "released_at": null
    }
  ],
  "gate_evidence": {
    "work_order": [
      ".ai-org/artifacts/WI-0272/work-order.md"
    ],
    "approved_scope": [
      ".ai-org/artifacts/WI-0272/work-order.md"
    ],
    "acceptance_criteria": [
      ".ai-org/artifacts/WI-0272/work-order.md"
    ],
    "technical_design": [
      ".ai-org/artifacts/WI-0272/work-order.md"
    ],
    "risk_review": [
      ".ai-org/artifacts/WI-0272/work-order.md"
    ]
  },
  "evidence": [
    ".ai-org/artifacts/WI-0272/work-order.md"
  ],
  "unresolved": [],
  "next_position": "quality_evaluator"
}
