{
  "schema_version": "temple.work-item/v1",
  "id": "WI-0257",
  "title": "Deliver the role-free Workkeel lifecycle and runtime connection boundary",
  "state": "cancelled",
  "owner_position": "engineering_manager",
  "assigned_agent_id": "agent-mog",
  "created_at": "2026-09-23T10:01:18.731Z",
  "updated_at": "2026-09-23T10:04:20.099Z",
  "scope": [
    "Provide an opt-in task-first canonical lifecycle, minimal project initialization, explicit legacy compatibility, and fixed-model Codex gateway configuration without introducing an execution engine."
  ],
  "acceptance_criteria": [
    "A fresh task-first project completes init, doctor, create, claim, exact-candidate handoff, independent review and close without Position or generic skill catalogs.",
    "Identity, scoped approvals, dependencies, evidence, stale claims and explicit migration guards are enforced; existing Temple projects remain usable without rewriting history.",
    "Runtime and model settings remain separate; optional LiteLLM wiring uses the existing Codex execution interface and never changes global settings or reads credentials during planning.",
    "Focused negative and end-to-end fixtures, package checks, exact-candidate full verification and independent review pass; live service limitations remain explicit."
  ],
  "affected_paths": [
    "src",
    "bin",
    "test/workkeel-lifecycle.test.mjs",
    "test/workkeel-runtime.test.mjs",
    "docs",
    "scripts/check-package.mjs",
    "package.json",
    "package-lock.json",
    ".ai-org/project/domain-glossary.md"
  ],
  "context_refs": [],
  "spec_refs": [],
  "ux_refs": [],
  "ui_refs": [],
  "contract_refs": [],
  "specification_mode": "gate-evidence",
  "ui_delivery_mode": "not-applicable",
  "workflow_profile": "standard",
  "risk_tier": "standard",
  "profile_assessment": {
    "requested_profile": "standard",
    "effective_profile": "standard",
    "scope_class": "cross-system",
    "escalation_triggers": [
      "schema-or-data-migration"
    ],
    "rationale": "Opt-in versioned metadata lifecycle with explicit guards, no sandbox or production deployment; preserve legacy authority.",
    "evidence_refs": [],
    "evaluated_at": "2026-09-23T10:01:18.718Z",
    "escalated": false
  },
  "parent_work_item_id": null,
  "tracker_visibility": "team-visible",
  "tracker_refs": [],
  "tracker_reconciliations": [],
  "dependencies": [],
  "required_disciplines": [],
  "stage_requirements": {},
  "base_revision": "9d0f8547",
  "parallel_mode": "sequential",
  "integration_owner_agent_id": null,
  "planned_agent_id": null,
  "shared_contract_refs": [],
  "contract_status": "not_required",
  "overlap_resolution": [],
  "claim": {
    "id": "claim-20260923100251-443cdba9",
    "status": "released",
    "principal_id": "human",
    "agent_id": "agent-rikku",
    "actor_provenance": {
      "selection": "explicit-agent",
      "principal_source": "explicit-principal",
      "verification_class": "attributed",
      "evidence_ref": null,
      "provider_authenticated": false,
      "externally_supplied_evidence": false
    },
    "position_id": "developer",
    "base_revision": "9d0f8547",
    "branch": "codex/workkeel-reframe",
    "worktree": ".",
    "claimed_at": "2026-09-23T10:02:51.851Z",
    "released_at": "2026-09-23T10:04:19.572Z",
    "release_reason": [
      "Cancel planning attempt with historical artifact filename collision"
    ]
  },
  "claims": [
    {
      "id": "claim-20260923100251-443cdba9",
      "status": "released",
      "principal_id": "human",
      "agent_id": "agent-rikku",
      "actor_provenance": {
        "selection": "explicit-agent",
        "principal_source": "explicit-principal",
        "verification_class": "attributed",
        "evidence_ref": null,
        "provider_authenticated": false,
        "externally_supplied_evidence": false
      },
      "position_id": "developer",
      "base_revision": "9d0f8547",
      "branch": "codex/workkeel-reframe",
      "worktree": ".",
      "claimed_at": "2026-09-23T10:02:51.851Z",
      "released_at": "2026-09-23T10:04:19.572Z",
      "release_reason": [
        "Cancel planning attempt with historical artifact filename collision"
      ]
    }
  ],
  "gate_evidence": {
    "work_order": [
      ".ai-org/artifacts/WI-0257/design.md"
    ],
    "approved_scope": [
      ".ai-org/artifacts/WI-0257/design.md"
    ],
    "acceptance_criteria": [
      ".ai-org/artifacts/WI-0257/design.md"
    ],
    "technical_design": [
      ".ai-org/artifacts/WI-0257/design.md"
    ],
    "risk_review": [
      ".ai-org/artifacts/WI-0257/design.md"
    ],
    "cancellation_reason": [
      ".ai-org/artifacts/WI-0257/workkeel-cancellation.md"
    ]
  },
  "evidence": [
    ".ai-org/artifacts/WI-0257/design.md",
    ".ai-org/artifacts/WI-0257/workkeel-cancellation.md"
  ],
  "unresolved": [],
  "next_position": null
}
