{
  "schema_version": "temple.work-item/v1",
  "id": "WI-0275",
  "title": "Observer usability and full task benefit measurements",
  "state": "build",
  "owner_position": "developer",
  "assigned_agent_id": "agent-rikku",
  "created_at": "2026-09-25T11:24:37.277Z",
  "updated_at": "2026-09-25T11:26:09.571Z",
  "scope": [
    "Localized read-only observer, actionable blockers, handoff copy and evidence-based lifecycle statistics"
  ],
  "acceptance_criteria": [
    "Traditional Chinese responsive observer with distinct completion states, safe handoff copy, conservative complete task phase statistics and verified browser coverage"
  ],
  "affected_paths": [
    "src",
    "test",
    "scripts",
    "docs",
    "README.md",
    "README.zh-TW.md",
    "README.ja.md"
  ],
  "context_refs": [],
  "spec_refs": [],
  "ux_refs": [],
  "ui_refs": [],
  "contract_refs": [],
  "specification_mode": "gate-evidence",
  "ui_delivery_mode": "code-first",
  "workflow_profile": "standard",
  "risk_tier": "standard",
  "profile_assessment": {
    "requested_profile": "standard",
    "effective_profile": "standard",
    "scope_class": "ordinary",
    "escalation_triggers": [],
    "rationale": "",
    "evidence_refs": [],
    "evaluated_at": "2026-09-25T11:24:37.266Z",
    "escalated": false
  },
  "parent_work_item_id": null,
  "tracker_visibility": "team-visible",
  "tracker_refs": [],
  "tracker_reconciliations": [],
  "dependencies": [],
  "required_disciplines": [],
  "stage_requirements": {},
  "base_revision": "0ed21c5dc3410dae3e063fee97e6fe741e49f22a",
  "parallel_mode": "pending",
  "integration_owner_agent_id": null,
  "planned_agent_id": null,
  "shared_contract_refs": [],
  "contract_status": "not_required",
  "overlap_resolution": [],
  "claim": {
    "id": "claim-20260925112609-9316ac30",
    "status": "active",
    "principal_id": "human",
    "agent_id": "agent-rikku",
    "actor_provenance": {
      "selection": "explicit-agent",
      "principal_source": "explicit-principal",
      "verification_class": "attributed",
      "evidence_ref": null,
      "provider_authenticated": false,
      "externally_supplied_evidence": false
    },
    "position_id": "developer",
    "base_revision": "0ed21c5dc3410dae3e063fee97e6fe741e49f22a",
    "branch": "codex/observer-benefits",
    "worktree": null,
    "claimed_at": "2026-09-25T11:26:09.571Z",
    "released_at": null
  },
  "claims": [
    {
      "id": "claim-20260925112527-b48986d7",
      "status": "released",
      "principal_id": "human",
      "agent_id": "agent-mog",
      "actor_provenance": {
        "selection": "explicit-agent",
        "principal_source": "explicit-principal",
        "verification_class": "attributed",
        "evidence_ref": null,
        "provider_authenticated": false,
        "externally_supplied_evidence": false
      },
      "position_id": "engineering_manager",
      "base_revision": "0ed21c5dc3410dae3e063fee97e6fe741e49f22a",
      "branch": "codex/observer-benefits",
      "worktree": null,
      "claimed_at": "2026-09-25T11:25:27.395Z",
      "released_at": "2026-09-25T11:25:45.684Z",
      "release_reason": "completed"
    },
    {
      "id": "claim-20260925112607-df9e23ee",
      "status": "released",
      "principal_id": "human",
      "agent_id": "agent-yuna",
      "actor_provenance": {
        "selection": "explicit-agent",
        "principal_source": "explicit-principal",
        "verification_class": "attributed",
        "evidence_ref": null,
        "provider_authenticated": false,
        "externally_supplied_evidence": false
      },
      "position_id": "product_manager",
      "base_revision": "0ed21c5dc3410dae3e063fee97e6fe741e49f22a",
      "branch": "codex/observer-benefits",
      "worktree": null,
      "claimed_at": "2026-09-25T11:26:07.074Z",
      "released_at": "2026-09-25T11:26:07.472Z",
      "release_reason": "completed"
    },
    {
      "id": "claim-20260925112608-9bbfa3bf",
      "status": "released",
      "principal_id": "human",
      "agent_id": "agent-tidus",
      "actor_provenance": {
        "selection": "explicit-agent",
        "principal_source": "explicit-principal",
        "verification_class": "attributed",
        "evidence_ref": null,
        "provider_authenticated": false,
        "externally_supplied_evidence": false
      },
      "position_id": "tech_lead",
      "base_revision": "0ed21c5dc3410dae3e063fee97e6fe741e49f22a",
      "branch": "codex/observer-benefits",
      "worktree": null,
      "claimed_at": "2026-09-25T11:26:08.326Z",
      "released_at": "2026-09-25T11:26:08.718Z",
      "release_reason": "completed"
    },
    {
      "id": "claim-20260925112609-9316ac30",
      "status": "active",
      "principal_id": "human",
      "agent_id": "agent-rikku",
      "actor_provenance": {
        "selection": "explicit-agent",
        "principal_source": "explicit-principal",
        "verification_class": "attributed",
        "evidence_ref": null,
        "provider_authenticated": false,
        "externally_supplied_evidence": false
      },
      "position_id": "developer",
      "base_revision": "0ed21c5dc3410dae3e063fee97e6fe741e49f22a",
      "branch": "codex/observer-benefits",
      "worktree": null,
      "claimed_at": "2026-09-25T11:26:09.571Z",
      "released_at": null
    }
  ],
  "gate_evidence": {
    "work_order": [
      ".ai-org/artifacts/WI-0275/work-order.md"
    ],
    "approved_scope": [
      ".ai-org/artifacts/WI-0275/work-order.md"
    ],
    "acceptance_criteria": [
      ".ai-org/artifacts/WI-0275/work-order.md"
    ],
    "technical_design": [
      "docs/adr/0078-observer-task-lifecycle-measurements.md"
    ],
    "risk_review": [
      ".ai-org/artifacts/WI-0275/work-order.md"
    ],
    "ui_brief": [
      ".ai-org/artifacts/WI-0275/ui-brief.md"
    ],
    "required_state_coverage": [
      ".ai-org/artifacts/WI-0275/ui-brief.md"
    ]
  },
  "evidence": [
    ".ai-org/artifacts/WI-0275/work-order.md",
    "docs/adr/0078-observer-task-lifecycle-measurements.md",
    ".ai-org/artifacts/WI-0275/ui-brief.md"
  ],
  "unresolved": [],
  "next_position": "quality_evaluator"
}
