{
  "schema_version": "temple.work-item/v1",
  "id": "WI-0270",
  "title": "Recover historical evidence with explicit artifact source revisions",
  "state": "build",
  "owner_position": "developer",
  "assigned_agent_id": "agent-rikku",
  "created_at": "2026-09-25T00:36:30.495Z",
  "updated_at": "2026-09-25T00:41:00.656Z",
  "scope": [
    "Append verified source maps for three historical evidence records; preserve tested revisions and canonical registry; compatible archive export and readback, documentation, tests, review and PR merge"
  ],
  "acceptance_criteria": [
    "Exact recorded bytes recoverable from explicitly verified Git sources; originals unchanged; hostile or stale mappings reject; full verification and actual distinct review"
  ],
  "affected_paths": [
    "src/evidence-bundle.mjs",
    "src/cli.mjs",
    "src",
    "test",
    "docs",
    "scripts/check-package.mjs"
  ],
  "context_refs": [],
  "spec_refs": [],
  "ux_refs": [],
  "ui_refs": [],
  "contract_refs": [],
  "specification_mode": "gate-evidence",
  "ui_delivery_mode": "not-applicable",
  "workflow_profile": "standard",
  "risk_tier": "standard",
  "profile_assessment": {
    "requested_profile": "standard",
    "effective_profile": "standard",
    "scope_class": "ordinary",
    "escalation_triggers": [],
    "rationale": "",
    "evidence_refs": [],
    "evaluated_at": "2026-09-25T00:36:30.481Z",
    "escalated": false
  },
  "parent_work_item_id": null,
  "tracker_visibility": "team-visible",
  "tracker_refs": [],
  "tracker_reconciliations": [],
  "dependencies": [],
  "required_disciplines": [],
  "stage_requirements": {},
  "base_revision": "aa9fb7287e5e6cc24d0d69153d1547b4d07e7ade",
  "parallel_mode": "pending",
  "integration_owner_agent_id": null,
  "planned_agent_id": null,
  "shared_contract_refs": [],
  "contract_status": "not_required",
  "overlap_resolution": [],
  "claim": {
    "id": "claim-20260925004100-dccf4b96",
    "status": "active",
    "principal_id": "human",
    "agent_id": "agent-rikku",
    "actor_provenance": {
      "selection": "explicit-agent",
      "principal_source": "explicit-principal",
      "verification_class": "attributed",
      "evidence_ref": null,
      "provider_authenticated": false,
      "externally_supplied_evidence": false
    },
    "position_id": "developer",
    "base_revision": "aa9fb7287e5e6cc24d0d69153d1547b4d07e7ade",
    "branch": "codex/evidence-source-repair",
    "worktree": null,
    "claimed_at": "2026-09-25T00:41:00.656Z",
    "released_at": null
  },
  "claims": [
    {
      "id": "claim-20260925003949-07df635a",
      "status": "released",
      "principal_id": "human",
      "agent_id": "agent-mog",
      "actor_provenance": {
        "selection": "explicit-agent",
        "principal_source": "explicit-principal",
        "verification_class": "attributed",
        "evidence_ref": null,
        "provider_authenticated": false,
        "externally_supplied_evidence": false
      },
      "position_id": "engineering_manager",
      "base_revision": "aa9fb7287e5e6cc24d0d69153d1547b4d07e7ade",
      "branch": "codex/evidence-source-repair",
      "worktree": null,
      "claimed_at": "2026-09-25T00:39:49.112Z",
      "released_at": "2026-09-25T00:40:56.988Z",
      "release_reason": [
        "Approved bounded source repair recorded"
      ]
    },
    {
      "id": "claim-20260925004057-ccc38608",
      "status": "released",
      "principal_id": "human",
      "agent_id": "agent-yuna",
      "actor_provenance": {
        "selection": "explicit-agent",
        "principal_source": "explicit-principal",
        "verification_class": "attributed",
        "evidence_ref": null,
        "provider_authenticated": false,
        "externally_supplied_evidence": false
      },
      "position_id": "product_manager",
      "base_revision": "aa9fb7287e5e6cc24d0d69153d1547b4d07e7ade",
      "branch": "codex/evidence-source-repair",
      "worktree": null,
      "claimed_at": "2026-09-25T00:40:57.960Z",
      "released_at": "2026-09-25T00:40:58.412Z",
      "release_reason": [
        "Approved scope and acceptance recorded"
      ]
    },
    {
      "id": "claim-20260925004059-4f525ffc",
      "status": "released",
      "principal_id": "human",
      "agent_id": "agent-tidus",
      "actor_provenance": {
        "selection": "explicit-agent",
        "principal_source": "explicit-principal",
        "verification_class": "attributed",
        "evidence_ref": null,
        "provider_authenticated": false,
        "externally_supplied_evidence": false
      },
      "position_id": "tech_lead",
      "base_revision": "aa9fb7287e5e6cc24d0d69153d1547b4d07e7ade",
      "branch": "codex/evidence-source-repair",
      "worktree": null,
      "claimed_at": "2026-09-25T00:40:59.390Z",
      "released_at": "2026-09-25T00:40:59.828Z",
      "release_reason": [
        "Exact-byte source map design and risks recorded"
      ]
    },
    {
      "id": "claim-20260925004100-dccf4b96",
      "status": "active",
      "principal_id": "human",
      "agent_id": "agent-rikku",
      "actor_provenance": {
        "selection": "explicit-agent",
        "principal_source": "explicit-principal",
        "verification_class": "attributed",
        "evidence_ref": null,
        "provider_authenticated": false,
        "externally_supplied_evidence": false
      },
      "position_id": "developer",
      "base_revision": "aa9fb7287e5e6cc24d0d69153d1547b4d07e7ade",
      "branch": "codex/evidence-source-repair",
      "worktree": null,
      "claimed_at": "2026-09-25T00:41:00.656Z",
      "released_at": null
    }
  ],
  "gate_evidence": {
    "work_order": [
      ".ai-org/artifacts/WI-0270/work-order.md"
    ],
    "approved_scope": [
      ".ai-org/artifacts/WI-0270/work-order.md"
    ],
    "acceptance_criteria": [
      ".ai-org/artifacts/WI-0270/work-order.md"
    ],
    "technical_design": [
      ".ai-org/artifacts/WI-0270/work-order.md"
    ],
    "risk_review": [
      ".ai-org/artifacts/WI-0270/work-order.md"
    ]
  },
  "evidence": [
    ".ai-org/artifacts/WI-0270/work-order.md"
  ],
  "unresolved": [],
  "next_position": "quality_evaluator"
}
